Wadeville;WadMarberry_Cons;SHOE;VSKORGINBR12;Veldskoen Shoe The Orgin Brown S12 ;2;0;0;R810,00;R1 620,00;99,0;;;0,0;;;;;;;;;;
Wadeville;WadMarberry_Cons;SHOE;VSKCHELGR06;Veldskoen Chelsea Farmer Brown S06 ;2;0;0;R808,16;R1 616,32;99,0;;;0,0;;;;;;;;;;
Wadeville;WadMarberry_Cons;SHOE;VSKCHELGR11;Veldskoen Chelsea Farmer Brown S11 ;2;0;0;R808,16;R1 616,32;99,0;;;0,0;;;;;;;;;;
Wadeville;WadMarberry_Cons;SHOE;VSKCHELGR12;Veldskoen Chelsea Farmer Brown S12 ;2;0;0;R808,16;R1 616,32;99,0;;;0,0;;;;;;;;;;
Wadeville;Wad_MW;MB;MBLYJJ54REFP#52;MB C/Suit Jkt J54 Ladies Ref Tape Yellow S52/132  ;8;0;0;R200,00;R1 600,00;99,0;2020/07/31;2020/08/03;0,0;;;;;;;;;;
Wadeville;Wad_MW;MB;AM0212382;MB C/Suit Jacket D59 Closed Front Orange S102/40 J0799800B59 50mm Ind Wash Silver Tape Arms/Breasts X On Back;12;0;0;R132,54;R1 590,48;99,0;2021/05/17;2021/05/26;0,0;;;;;;;;;;
Wadeville;Wad_MW;MB;T1JEM400STD52;MB Denim Stretch Jeans Indigo Blue S52/132  ;7;0;0;R225,00;R1 575,00;99,0;2023/09/14;2022/08/29;0,0;;;;;;;;;;
Wadeville;Wad_MW;MB;MBCSEGC958;MB C/Suit P/Cott C9 Cut 80/20 E/Green S58/147;10;0;0;R156,80;R1 568,00;99,0;2021/10/20;;0,0;6,0;Tzaneen;7;6;;;;;;
Wadeville;Wad_MW;BOOT;FBB30403;Safety Boot Rebel Hiker Hi STC Black S03 RE304-BK;2;0;0;R779,95;R1 559,90;99,0;2022/07/05;2022/04/21;0,0;9,0;Rustenburg;3;6;Middelburg;0;3;;;
Wadeville;Wad_MW;GLOV;55MJAXJSI;Glove TaeKi5 Leather Palm Grey PVC Dotted XL S10  Back Cut 5 Seamless Knit Wrist ;14;0;0;R111,32;R1 558,48;99,0;;2020/01/20;0,0;;;;;;;;;;
Wadeville;Wad_MW;MB;MBTRBD5938;MB C/Suit Trouser D59 SABS Royal Blue S38/97  ;9;0;0;R172,44;R1 551,97;27,0;2023/02/06;2026/02/26;0,3;1,0;Polokwane;1;1;Wadeville;9;0;;;
Wadeville;Wad_MW;MB;MBLYJJ54REFP#50;MB C/Suit Jkt J54 Ladies Ref Tape Yellow S50/127  ;8;0;0;R192,00;R1 536,00;99,0;2020/07/31;2020/08/03;0,0;;;;;;;;;;
Wadeville;Wad_MW;CS;SOTJ54L50/127;C/Suit Trouser J54 Ladies S/Orr AGP S50/127 2402747;6;0;0;R256,00;R1 536,00;99,0;2024/02/01;2024/10/31;0,0;;;;;;;;;;
Wadeville;Wad_MW;BOOT;P72613208;Boot Cat Propane 2.0 NSTC Dark Brown S08;1;0;0;R1 530,00;R1 530,00;99,0;2025/06/25;2025/07/22;0,0;2,0;Polokwane;0;1;;;;;;
Wadeville;Wad_MW;BS;BSO38;B/Suit Orange S38/97;19;0;0;R80,00;R1 520,00;57,0;2024/12/09;2025/09/25;0,3;41,0;Bloemfontein;0;37;Tzaneen;0;3;Wadeville;0;1
Wadeville;Wad_MW;BOOT;FBB4000209;Safety Boot Bova Dakota STC Black S09  ;2;0;0;R759,81;R1 519,62;99,0;2022/04/07;2023/02/24;0,0;;;;;;;;;;
Wadeville;Wad_MW;BOOT;FBB4000210;Safety Boot Bova Dakota STC Black S10  ;2;0;0;R759,80;R1 519,61;99,0;2022/02/10;2022/05/12;0,0;;;;;;;;;;
Wadeville;Wad_MW;GLOV;TOG4B08;Glove Blk/Grn/Blue Sandy Nitrile Coated Cut 4 S08;11;0;0;R138,00;R1 518,00;99,0;2023/08/08;2023/08/10;0,0;3932,0;Polokwane;646;3792;Steelpoort;29;129;Vereeniging;0;11
Wadeville;Wad_MW;GLOV;59YSP-10;Glove TaeKi5 Grip & Cut 5 Resis Blue/White XL S10  Latex Palm Coated Cut 5 Seamless Knit Wrist ;28;0;0;R54,00;R1 512,00;99,0;2022/05/11;2024/08/06;0,0;141,0;Pretoria;1;120;Bloemfontein;89;20;Newcastle;0;1
Wadeville;Wad_MW;MB;MBCSCBC952;MB C/Suit Poly/Cotton C9 Cut 80/20 Brown S52/132;10;0;0;R150,95;R1 509,50;99,0;2025/03/19;;0,0;4,0;Tzaneen;18;4;;;;;;
Wadeville;Wad_MW;PC;KNEEPAD;Hard plastic knee wear pad, dual straps;20;0;0;R75,00;R1 500,00;99,0;2024/01/23;2022/07/22;0,0;42,0;White River;48;22;Pretoria;3;20;;;
Wadeville;Wad_MW;REFL;METJAC#5XL;Jacket Metro Zip Off Sleeves Orange/Lime 5XL;17;0;20;R88,02;R1 496,31;18,5;2025/05/09;2025/11/27;2,0;17,0;Wadeville;17;9;White River;1;4;Tzaneen;0;2
Wadeville;Wad_MW;MB;MBCSCBC932;MB C/Suit Poly/Cotton C9 Cut 80/20 Brown S32/82;13;0;0;R115,00;R1 495,00;99,0;2022/11/01;2023/04/18;0,0;9,0;Tzaneen;7;8;Potchefstroom;0;1;;;
Wadeville;Wad_MW;ANS;29-500/08;Ansell Neotop Neoprene Lined 300mm 3121 Black M 3231 ;54;0;0;R27,46;R1 482,85;99,0;2019/06/07;2019/05/16;0,0;;;;;;;;;;
Wadeville;Wad_MW;HEAD;909CLB-A2;Safety Cap Rhino W/Lamp Bracket Powder Blue  4-Point Liner ;121;0;0;R12,23;R1 479,39;99,0;;2025/03/17;0,0;-118,0;Middelburg;0;2;Wadeville;121;-120;;;
Wadeville;Wad_MW;SHOE;DOTSHOE11;Safety Shoe DOT Cobalt STC Black S11;5;0;0;R295,00;R1 475,00;15,0;2024/08/02;2026/02/12;0,3;2,0;Wadeville;5;2;;;;;;
Wadeville;Wad_MW;CS;SOTDLREINF26/67;C/Suit Denim Trs Lady ReIn K/H S/Orr AGP S26/67 14N69M00466.PD-190802 V02  2402758;5;0;0;R295,00;R1 475,00;99,0;2024/03/20;2022/07/07;0,0;;;;;;;;;;
Wadeville;Wad_MW;MB;MBCSCBC946;MB C/Suit Poly/Cotton C9 Cut 80/20 Brown S46/117;11;0;60;R132,85;R1 461,35;99,0;2024/07/24;2023/04/18;0,0;153,0;Tzaneen;88;153;;;;;;
Wadeville;Wad_MW;BOOT;FBB4200706;Safety Boot Bova Smelters Buckle Alum TC Black S06  ;1;0;0;R1 441,23;R1 441,23;99,0;2023/06/06;2023/06/07;0,0;70,0;Vereeniging;4;35;Middelburg;21;23;Secunda;0;5
Wadeville;Wad_MW;3M;SF601SGAF-EU;3M S/Spec Securefit 600 Clear Lens AntiFog/Sctatch 70071676830;22;0;0;R65,32;R1 436,97;99,0;2019/08/20;2024/04/11;0,0;;;;;;;;;;
Wadeville;Wad_MW;DUPO;D14886039;Dupont Tyvek 200 Easysafe Type 5/6 S  ;19;0;400;R75,21;R1 429,02;1257,0;2024/04/05;2026/03/11;0,3;9,0;Rustenburg;192;8;Wadeville;19;1;;;
Wadeville;Wad_MW;GUM;XBG25SM06;Gumboot Stimela XP Black/Grey CompTC+Metata S06 XBG25SM Yellow Diamond;6;0;0;R235,22;R1 411,31;99,0;2025/08/28;2022/08/11;0,0;5,0;Rustenburg;5;5;;;;;;
Wadeville;Wad_MW;CS;SOJJ54N34/87N;C/Suit Jacket J54 Navy S/Orr AGP S34/87 Nigel 2402542 ;6;0;0;R234,96;R1 409,75;99,0;;;0,0;;;;;;;;;;
Wadeville;Wad_MW;CS;SOJJ54N32/82B;C/Suit Jacket J54 Navy S/Orr AGP S32/82 Belville 2402540;6;0;0;R234,86;R1 409,18;99,0;;;0,0;;;;;;;;;;
Wadeville;Wad_MW;MB;AM0212304;MB C/Suit D59 Closed Front Yellow Ladies S132/52 C1LAJ600S59-132/52  50mm Ind Wash Silver Tape Arms/Breasts X On Back;6;0;0;R234,77;R1 408,62;99,0;2019/08/15;2019/09/25;0,0;;;;;;;;;;
Wadeville;Wad_MW;REFL;C476YNRL;Reflective Contrast Executive Vest Yellow/Navy L  ;5;0;0;R281,00;R1 404,99;99,0;2025/07/10;2024/10/31;0,0;;;;;;;;;;
Wadeville;Wad_MW;REFL;C476YNRM;Reflective Contrast Executive Vest Yellow/Navy M  ;5;0;0;R281,00;R1 404,99;99,0;2025/07/10;2024/10/31;0,0;;;;;;;;;;
Wadeville;Wad_MW;REFL;C476YNRXL;Reflective Contrast Executive Vest Yellow/Navy XL  ;5;0;0;R281,00;R1 404,99;99,0;2025/07/10;2024/10/31;0,0;;;;;;;;;;
Wadeville;Wad_MW;CS;SOJJ54N44/112WT;C/Suit Jacket J54 Navy S/Orr AGP S44/112 Wade Temp 2402547;6;0;0;R233,90;R1 403,40;99,0;;;0,0;;;;;;;;;;
Wadeville;Wad_MW;SHOE;LS0504;Safety Shoe Profit Silk Ladies Pink/Black S04 Lightweight Slip On;4;0;0;R350,00;R1 400,00;99,0;2025/01/17;2025/03/05;0,0;2,0;Vereeniging;0;2;Pretoria;0;1;Wadeville;0;-1
Wadeville;Wad_MW;FOOT;REBELSOCK4-7;Socks Rebel S 4-7 Grey  SGY-S/L M  ;35;0;0;R39,95;R1 398,25;99,0;2024/01/17;2024/09/30;0,0;2,0;Pretoria;7;2;;;;;;
Wadeville;Wad_MW;CS;SOJJ54N48/122PES;C/Suit Jacket J54 Navy S/Orr AGP S48/122 PES 2402549 ;6;0;0;R232,49;R1 394,93;99,0;;;0,0;;;;;;;;;;
Wadeville;Wad_MW;CS;SOJD48/122PES;C/Suit Jacket Denim S/Orr AGP S48/122 PES 2402571 ;5;0;0;R278,54;R1 392,68;99,0;;;0,0;;;;;;;;;;
Wadeville;Wad_MW;JACK;BJNB7XL;Bunny Jacket Refl Navy R/W 7XL;2;0;0;R695,00;R1 390,00;99,0;2024/07/23;2024/07/22;0,0;;;;;;;;;;
Wadeville;Wad_MW;MB;AM0212189;MB B/Suit PolyViscose Green Acid Resist S112/44 A1ANG30965A-112/44;3;0;0;R462,85;R1 388,55;99,0;2024/05/03;2024/05/07;0,0;;;;;;;;;;
Wadeville;Wad_MW;UVEX;60027#09;Glove Uvex Athletic Lite Blue/Black S09/L NBR FoamCoated Knitted Wrist ;45;0;0;R30,83;R1 387,50;135,0;2021/08/10;2025/08/20;0,3;88,0;Potchefstroom;10;57;Kathu;0;30;Wadeville;0;1
Wadeville;Wad_MW;EYE;SB5720D;S/Spec Pyramex Venture 111 Infinity Grey Lens A/F   ;21;0;0;R65,13;R1 367,73;99,0;;2026/03/18;0,0;;;;;;;;;;
Wadeville;WadEmbr_MW;SHRT;WW-GSNRES;Work Wear Golf Shirt - Navy S;8;0;0;R169,95;R1 359,60;24,0;;;0,3;1,0;Wadeville;8;1;;;;;;
Wadeville;Wad_MW;MB;MBCSTNJ5456;MB C/Suit Trs J54 Navy S56/142;9;0;0;R150,00;R1 350,00;99,0;2024/01/19;2023/09/11;0,0;;;;;;;;;;
Wadeville;Wad_MW;MB;765124025;MB Pull Over D59 F/Retardant Fern Green S52/60 C2509317B37-152/60 ;3;0;0;R449,50;R1 348,50;99,0;2019/05/15;2023/03/16;0,0;;;;;;;;;;
Wadeville;Wad_MW;BELT;CAPBELTDXL;Belt Cap Lamp DBLStrap (Battery/SCSR) XL;32;0;0;R42,00;R1 344,00;99,0;2024/11/15;2024/11/21;0,0;;;;;;;;;;
Wadeville;Wad_MW;MB;MBS9MSS600ATF2XL;MB Two Tone Yel/Navy Mens S/Sleeve Shirt 2XL With 50mm Silver Reflective Tape Around The Waist Twice And Around Both Arms;6;0;0;R224,00;R1 344,00;99,0;2025/01/24;;0,0;6,0;Middelburg;10;3;Potchefstroom;3;2;Secunda;0;1
Wadeville;Wad_MW;SHOE;FX2-S11;Safety Shoe Rebel FX2 STC Black S11  ;4;0;0;R335,87;R1 343,47;99,0;2022/04/07;2024/01/16;0,0;9,0;Tzaneen;8;6;Phalaborwa;0;2;Pretoria;0;1
Wadeville;Wad_MW;MB;MBJRBD5952;MB C/Suit Jacket D59 Royal Blue SABS S52/132  ;9;0;0;R149,00;R1 341,00;99,0;;;0,0;;;;;;;;;;
Wadeville;Wad_MW;MB;MBCSRC954;MB C/Suit Poly/Cotton C9 Cut 80/20 Red S54/137;9;0;0;R148,68;R1 338,11;99,0;2023/12/20;2023/09/27;0,0;18,0;Tzaneen;8;17;White River;3;1;;;
Wadeville;Wad_MW;BOOT;JS07#09;Safety Boot Profit Bagheera Blk Chelsea  S09 Pu/Pu ;2;0;0;R660,00;R1 320,00;99,0;2024/04/19;2024/05/08;0,0;4,0;White River;0;3;Vereeniging;0;1;;;
Wadeville;Wad_MW;CS;SOJJ54N60/152W;C/Suit Jacket J54 Navy S/Orr AGP S60/152 Wadeville ;4;0;0;R330,00;R1 320,00;99,0;;;0,0;;;;;;;;;;
Wadeville;Wad_MW;GUM;STEOUT12;Gumboot Claw Outback Black/Grey PVC Ankle STC S12;7;0;0;R186,50;R1 305,50;99,0;2018/10/24;2019/11/07;0,0;;;;;;;;;;
Wadeville;Wad_MW;MB;MBTRBD5952;MB C/Suit Trouser D59 SABS Royal Blue S52/132  ;9;0;0;R145,00;R1 305,00;99,0;;;0,0;;;;;;;;;;
Wadeville;Wad_MW;BELT;CAPBELTPAD#M;Belt Miners Padded c/w Battery/SCSR Strap  M;4;0;0;R325,55;R1 302,18;99,0;2023/04/20;2024/07/26;0,0;146,0;Polokwane;173;146;;;;;;
Wadeville;Wad_MW;MB;MBGOCSEGJ5458;MB C/Suit Gold Range J54 Emerald Green S58/147  ;5;0;0;R260,00;R1 300,00;99,0;2021/06/21;;0,0;;;;;;;;;;
Wadeville;Wad_MW;MB;MBGOCSEGJ5460;MB C/Suit Gold Range J54 Emerald Green S60/152  ;5;0;0;R260,00;R1 300,00;99,0;2021/06/21;;0,0;;;;;;;;;;
Wadeville;Wad_MW;MB;MBGOCSKHJ5456;MB C/Suit Gold Range J54 Khaki S56/142  ;5;0;0;R260,00;R1 300,00;99,0;2021/06/11;;0,0;;;;;;;;;;
Wadeville;Wad_MW;MB;MBGOCSKHJ5458;MB C/Suit Gold Range J54 Khaki S58/147  ;5;0;0;R260,00;R1 300,00;99,0;2021/06/11;;0,0;;;;;;;;;;
Wadeville;Wad_MW;MB;MBGOCSRJ5436;MB C/Suit Gold Range J54 Red S36/92  ;5;0;0;R260,00;R1 300,00;99,0;2021/06/08;;0,0;9,0;Polokwane;5;9;;;;;;
Wadeville;Wad_MW;MB;MBGOCSRJ5452;MB C/Suit Gold Range J54 Red S52/132  ;5;0;0;R260,00;R1 300,00;99,0;2021/06/08;;0,0;;;;;;;;;;
Wadeville;WadSerNDCen_MW;MB;AM0212227;MB B/Suit D59 Royal Blue S112/44  A1ANG406B59-112/44   9000001444;3;0;0;R431,41;R1 294,24;99,0;;;0,0;2,0;Secunda;0;2;;;;;;
Wadeville;Wad_MW;JACK;BJLDS#M;Bunny Jacket Lime Detachable Sleeves M;3;0;0;R430,00;R1 290,00;99,0;2024/07/26;2024/07/10;0,0;57,0;Richards Bay;34;33;Marburg;0;23;Polokwane;0;1
Wadeville;Wad_MW;MB;MBLYJJ54REFP#48;MB C/Suit Jkt J54 Ladies Ref Tape Yellow S48/122  ;7;0;0;R184,00;R1 288,00;99,0;2020/07/31;2020/08/03;0,0;;;;;;;;;;
Wadeville;Wad_MW;BOOT;RE65212;Safety Boot Rebel Crazy Horse STC Tan S12 RE65-TA;1;0;0;R1 269,95;R1 269,95;99,0;2025/02/20;2025/02/21;0,0;2,0;Vereeniging;0;1;;;;;;
Wadeville;Wad_MW;CS;SOJJ54N54/137B;C/Suit Jacket J54 Navy S/Orr AGP S54/137 Bellville 2402616;5;0;0;R250,29;R1 251,44;99,0;;;0,0;;;;;;;;;;
Wadeville;Wad_MW;SHOE;FSB38003;Safety Shoe Rebel Chukka STC Black S03 RE380;3;0;0;R417,03;R1 251,10;99,0;2023/03/10;2023/03/28;0,0;1,0;Marburg;0;1;White River;0;0;;;
Wadeville;Wad_MW;BELT;KBM;Belt Kidney Leather (M);8;0;0;R154,00;R1 232,00;99,0;2021/01/27;2021/02/10;0,0;;;;;;;;;;
Wadeville;Wad_MW;MB;MBLYJJ54REFP#46;MB C/Suit Jkt J54 Ladies Ref Tape Yellow S46/117  ;7;0;0;R176,00;R1 232,00;99,0;2020/07/31;2020/08/03;0,0;;;;;;;;;;
Wadeville;Wad_MW;BOOT;FBB4200712;Safety Boot Bova Smelters Buckle Alum TC Black S12  ;1;0;0;R1 221,69;R1 221,69;99,0;2021/05/07;2021/05/19;0,0;4,0;Vereeniging;5;3;Rustenburg;5;1;;;
Wadeville;Wad_MW;BOOT;RE517412;Safety Boot Rebel Jigga Comp Toe Cap Black S12  ;2;0;0;R609,95;R1 219,90;99,0;2022/02/07;2024/08/29;0,0;;;;;;;;;;
Wadeville;Wad_MW;MB;MBGOCSRB28;MB C/Suit Gold Range P/Cot 80/20 R/Blue S28/72  ;8;0;0;R152,25;R1 218,00;24,0;2024/03/18;2025/12/18;0,3;11,0;White River;1;5;Pretoria;5;4;Phalaborwa;0;1
Wadeville;Wad_MW;UVEX;9164145;S/Spec Uvex Astrospec 2.0 Weld SH5.0 Blk/Green Anti-Fog & Scratch Infradur ;8;0;0;R152,00;R1 216,00;99,0;2024/03/18;2025/01/21;0,0;1,0;Richards Bay;0;1;;;;;;
Wadeville;Wad_MW;BELT;CAPBELTPAD#S;Belt Miners Padded c/w Battery/SCSR Strap  S;4;0;0;R303,94;R1 215,76;99,0;2023/04/20;2023/05/02;0,0;252,0;Polokwane;178;252;;;;;;
Wadeville;Wad_MW;CS;SOTDSPL28/72;C/Suit Trouser Denim 10cm Shorter Legs S28/72 14N68601766.PA;5;0;0;R242,00;R1 210,00;99,0;2024/02/14;2023/10/09;0,0;;;;;;;;;;
Wadeville;Wad_MW;CS;SOJD59MANORREF56/142;C/Suit Jacket D59 F/Acid Manager S/Orr AGP S56/142 13N70215056.CA-19802.01 S142;3;0;0;R401,00;R1 203,00;99,0;2024/06/05;2024/06/10;0,0;;;;;;;;;;
Wadeville;Wad_MW;EYE;B/MAXA;S/Spec BlackMax Amber Lens Anti Fog SS1840BAA  ;58;0;0;R20,65;R1 197,70;14,5;;2025/03/05;4,0;69,0;Vereeniging;0;30;Pretoria;3;24;Wadeville;0;12
Wadeville;Wad_MW;ANS;11-25016W;Ansell Hyflex 11250 Size 16 No Thumbslot Wide  ;20;0;0;R59,41;R1 188,29;15,0;2024/05/24;2025/08/04;1,3;153,0;Vereeniging;118;146;Wadeville;20;6;Pretoria;0;1
Wadeville;Wad_MW;OBS;PBSAN500ML;"Hand Sanitizer Liquid ""Pienaar Bros"" 500ml 70% Alcohol";1186;0;0;R1,00;R1 186,00;355,8;2020/05/06;2025/08/04;3,3;20,0;Wadeville;1436;10;Middelburg;23;6;Polokwane;0;2
Wadeville;Wad_MW;GUM;GSH138W11;Gumboot Stimela+STC+Metatarsal+SMS Wide S11 ZBG25SPMW11 Wide Green Dot Was Shosholoza   Now Renamed Stimela;3;0;0;R394,70;R1 184,10;99,0;2023/03/27;2023/03/30;0,0;;;;;;;;;;
Wadeville;Wad_MW;GLOV;5613XL;Glove Miners Padded Hi-Viz Reflective 2121 XL  ;7;0;0;R169,00;R1 183,00;21,0;2024/02/26;2021/03/18;0,3;1,0;Wadeville;7;1;;;;;;
Wadeville;WadSerNDCen_MW;BELT;CAPBELTSERS;Belt Cap Lamp DBLStrap Battery/SCSR Seriti Spec S;7;0;0;R169,00;R1 183,00;99,0;;;0,0;;;;;;;;;;
Wadeville;Wad_MW;RAGS;RMC25;Rags Sterilised Coloured Vesting Price/Bail 25Kg ;4;60;0;R293,03;R1 172,12;99,0;;;0,0;92,0;Steelpoort;0;100;Wadeville;293;-8;;;
Wadeville;Wad_MW;MB;AM0212387;MB C/Suit Jacket D59 Closed Front Orange 122/48  J0799800B59 50mm Ind Wash Silver Tape Arms/Breasts X On Back;8;0;0;R144,75;R1 158,02;99,0;2020/07/14;2019/07/24;0,0;;;;;;;;;;
Wadeville;Wad_MW;SHOE;RE682BK05;Safety Shoe Rebel Iman Ladies STC Black S05  ;2;0;0;R574,95;R1 149,90;99,0;2025/02/14;2023/10/11;0,0;;;;;;;;;;
Wadeville;Wad_MW;EYE;VS107R-2.5;S/Spec Magnimax Clear Lens 2.50 Magnification  ;58;0;0;R19,75;R1 145,51;99,0;2021/01/06;2024/01/18;0,0;;;;;;;;;;
Wadeville;Wad_MW;GUM;ZBG25SP04;Gumboot Stimela Black/Grey+STC+SMS S04 ZBG25SP04 Green Dot Sosoloza Now Named Stimela Now Renamed Stimela;7;0;0;R163,30;R1 143,10;99,0;2019/03/27;2019/03/29;0,0;;;;;;;;;;
Wadeville;Wad_MW;MB;MBLYJJ54REFP#44;MB C/Suit Jkt J54 Ladies Ref Tape Yellow S44/112  ;7;0;0;R160,00;R1 120,00;99,0;2020/07/31;2020/08/03;0,0;;;;;;;;;;
Wadeville;Wad_MW;SHOE;584-661506;Shoe Bata Ladies PerFormer Black S06  ;5;0;0;R223,00;R1 115,00;15,0;2025/04/08;2026/02/24;0,3;1,0;Wadeville;5;1;;;;;;
Wadeville;Wad_MW;GLOV;ULTICHEM-08;Glove Ultichem Chemical Nitrile Tripple Dip S08 Nitrile Tripple Dipped, Non-Slip, Waterproof;15;0;0;R74,00;R1 110,00;99,0;2022/01/26;2022/01/26;0,0;5,0;Middelburg;0;5;Tzaneen;0;0;;;
Wadeville;Wad_MW;3M;SF203AF-EU;3M Securefit 200 Spectacle AS/AF Amber Lens 70071695533;31;0;0;R35,63;R1 104,58;99,0;2019/03/25;2023/09/05;0,0;;;;;;;;;;
Wadeville;Wad_MW;MISC;MANBOOKPO;Book - Manual Purchase Orders -;15;0;0;R73,60;R1 104,00;99,0;;;0,0;;;;;;;;;;
Wadeville;Wad_MW;JACK;FRJKTY#4XL;Vest Flame Retardant Yellow Sleeveless  4XL With Cellphone Pocket Top Left Front Bottom  Pockets 2 Flaps;11;0;0;R99,89;R1 098,78;99,0;2025/05/09;;0,0;9,0;White River;0;5;Secunda;30;4;;;
Wadeville;Wad_MW;CS;SOJD59MAN28/72H/O;C/Suit Jkt D59 F/Acid Manager S/Orr AGP S28/72 HO With Reflective Tape;3;0;0;R365,00;R1 095,00;99,0;;;0,0;;;;;;;;;;
Wadeville;Wad_MW;BOOT;FBB4160211;Safety Boot Bova Drogue STC PU/Rubber Black S11 Now 43602 Was 41602 ;1;1;0;R1 094,83;R1 094,83;99,0;2024/08/29;2024/08/29;0,0;3,0;Richards Bay;0;3;Vereeniging;0;0;;;
Wadeville;Wad_MW;RESP;MASKSURGP;Disposable Surgical Face Mask 3 Ply Pink Elasticated Ear Loop (50 Per Box/Pack) ;2950;0;0;R0,37;R1 091,50;99,0;2021/08/26;2022/05/27;0,0;;;;;;;;;;
Wadeville;Wad_MW;MB;AM0212356;MB C/Suit D59 C/Front Ladies Orange S92/36   C1LAJ800B59-92/36 50mm Ind Wash Silver Tape Arms/Breasts X On Back;4;0;0;R272,36;R1 089,44;99,0;2021/02/25;2021/12/14;0,0;;;;;;;;;;
Wadeville;Wad_MW;SHOE;JCB1811#06;Shoe JCB Jogger Ultra-Light Comp Toe Cap White S06;2;0;0;R540,00;R1 080,00;99,0;2025/08/20;2024/03/19;0,0;0,0;Wadeville;2;0;;;;;;
Wadeville;Wad_MW;GLOV;GLG20/08;Glove Green Lined 8 Cuff Size 8;26;0;0;R41,42;R1 076,82;99,0;2025/07/28;;0,0;45,0;Rustenburg;13;45;;;;;;
Wadeville;Wad_MW;GLOV;42-874/11;Glove Maxiflex Ultimate Adapt Open/Back 2XL S11 4131 ;17;0;0;R63,25;R1 075,19;51,0;2024/07/08;2026/02/16;0,3;54,0;Pretoria;0;48;Rustenburg;22;5;Wadeville;0;1
Wadeville;Wad_MW;MB;MBT1ARC402NOM48;MB Nomex Essential Trs Zero Arc  12.4Cal S48/122 Navy C/W 50mm Silver FR Tape Around Legs 2 Flap Pockets & FR Velcro Closure;1;0;0;R1 075,00;R1 075,00;99,0;2023/07/03;;0,0;6,0;Polokwane;2;6;;;;;;
Wadeville;Wad_MW;MISC;MANBOOK - I;Book - Manual Invoice -Vereeniging;21;0;0;R51,17;R1 074,62;99,0;2018/05/21;;0,0;;;;;;;;;;
Wadeville;Wad_MW;MB;MBCSEGC956;MB C/Suit P/Cott C9 Cut 80/20 E/Green S56/142;7;0;0;R151,20;R1 058,40;99,0;2021/10/20;;0,0;1,0;Tzaneen;8;1;;;;;;
Wadeville;Wad_MW;GUM;GWSTC04;Gumboot Egoli White/White Sole STC 1271 S04;6;0;0;R176,39;R1 058,33;18,0;2025/02/21;2025/11/04;0,3;14,0;Bloemfontein;10;9;Vereeniging;21;3;Potchefstroom;0;1
Wadeville;WadMarberry_Cons;GLOV;GSH731-10;Glove Showa Biodegradable Created W/Premuim S10 Grade Polymers And Nitrile 15-mil Green Bisque  Finish Flocklined;50;0;0;R21,04;R1 051,76;15,0;;;3,3;787,0;Potchefstroom;1600;576;Polokwane;38;192;Wadeville;0;15
Wadeville;Wad_MW;OBS;M2SEC402D15;ComFort Mask Mini Matt Navy Mask + Mesh Mask No EMB ;1040;0;0;R1,00;R1 040,00;99,0;;;0,0;;;;;;;;;;
Wadeville;Wad_MW;MB;MBGOCSEGJ5454;MB C/Suit Gold Range J54 Emerald Green S54/137  ;4;0;0;R260,00;R1 040,00;99,0;2021/06/21;;0,0;;;;;;;;;;
Wadeville;Wad_MW;MB;MBGOCSEGJ5456;MB C/Suit Gold Range J54 Emerald Green S56/142  ;4;0;0;R260,00;R1 040,00;99,0;2021/06/21;2024/01/29;0,0;;;;;;;;;;
Wadeville;Wad_MW;MB;MBGOCSRJ5448;MB C/Suit Gold Range J54 Red S48/122  ;4;0;0;R260,00;R1 040,00;99,0;2021/06/08;;0,0;;;;;;;;;;
Wadeville;Wad_MW;MB;MBGOCSR30;MB C/Suit Gold Range P/Cot 80/20 Red S30/77  ;7;0;0;R146,10;R1 022,70;99,0;2022/05/09;2022/07/26;0,0;;;;;;;;;;
Wadeville;Wad_MW;BOOT;FBT9000407;Safety Boot Bova Neoflex STC Richmond S07  ;2;0;0;R508,73;R1 017,46;99,0;2024/05/21;2024/10/01;0,0;313,0;Kathu;0;270;White River;65;21;Bloemfontein;0;17
Wadeville;Wad_MW;ANS;80-600/08;Ansell Powerflex Rubber Palm Coat Kevlar Cut 4 S08  ;6;0;144;R166,51;R999,04;22,5;2023/12/19;2025/12/03;6,7;30,0;Wadeville;6;30;;;;;;
Wadeville;Wad_MW;JACK;FRJKTY#S;Vest Flame Retardant Yellow Sleeveless  S With Cellphone Pocket Top Left Front Bottom  Pockets 2 Flaps;10;0;0;R99,89;R998,89;99,0;2025/05/09;;0,0;13,0;White River;37;13;;;;;;
Wadeville;Wad_MW;MB;MBGOCSRB56;MB C/Suit Gold Range P/Cott 80/20 R/Blue S56/142  ;5;0;0;R199,52;R997,58;15,0;2024/01/08;2025/12/18;0,3;24,0;Tzaneen;3;19;Polokwane;8;2;White River;0;1
Wadeville;Wad_MW;GUM;ZBG25S06;Gumboot Stimela Black/Grey+STC S06 ZBG25S06 Orange Dot Sosoloza Now Named Stimela;5;0;0;R199,22;R996,10;15,0;2024/07/16;2025/04/04;0,3;33,0;Rustenburg;17;32;Wadeville;5;1;;;
Wadeville;Wad_MW;BOOT;GFBBFLINT305;Safety Boot Grittgear Flint3 Blk Kevlar MS STC S05  ;1;0;0;R995,00;R995,00;99,0;2025/03/12;;0,0;2,0;Richards Bay;0;2;;;;;;
Wadeville;Wad_MW;SHRT;6137NY#M;Shirt Vented HIVis Refl Short Sleeve Navy/Yellow M;4;0;0;R245,09;R980,36;99,0;2024/12/11;;0,0;2,0;Tzaneen;0;2;;;;;;
Wadeville;WadSerNDCen_MW;EYE;SG-57C;S/Spec Elvex OVR-Spec III  Clear Lens HC/PC Clear Frame ;24;0;0;R40,62;R974,99;99,0;;;0,0;539,0;Middelburg;199;266;Steelpoort;242;244;Rustenburg;0;29
Wadeville;Wad_MW;MISC;MANBOOKGRV - A;Book - Manual Goods Received Vouchers -Wadeville;21;0;0;R46,05;R967,00;99,0;2021/11/03;;0,0;;;;;;;;;;
Wadeville;Wad_MW;RESP;C20357N;Cartridge B1 Inorg/Vapour Acid Gas C10 Box & Lid;26;0;0;R36,43;R947,18;19,5;2025/03/06;2025/05/22;1,3;4490,0;Tzaneen;1208;4224;Vereeniging;38;220;Bloemfontein;0;42
Wadeville;Wad_MW;SHOE;FSB819212;Safety Shoe Lemaitre Robust STC Black S12  Now 8102 ;3;0;0;R315,14;R945,41;99,0;2021/10/12;2022/04/06;0,0;2,0;White River;1;1;;;;;;
Wadeville;Wad_MW;MB;MBCSGC958;MB C/Suit Poly/Cotton C9 Cut 80/20 Grey S58/147;6;0;0;R156,80;R940,80;99,0;2021/09/06;;0,0;;;;;;;;;;
Wadeville;Wad_MW;CAP;2CHINELAS;Chin Strap 2 Point Black - Elasticated  ;99;0;0;R9,50;R940,50;297,0;;2025/08/07;0,3;3425,0;Rustenburg;764;3424;Wadeville;99;1;;;
Wadeville;Wad_MW;CS;SOTJ54N26/67;C/Suit Trouser J54 Navy S/Orr AGP S26/67 2402894 ;5;0;0;R188,00;R940,00;99,0;2023/11/09;2023/10/06;0,0;;;;;;;;;;
Wadeville;Wad_MW;BOOT;RE911-S304;Safety Boot Rebel Black Hawk STC SMS Black S04  ;1;0;0;R939,95;R939,95;99,0;2024/06/27;2020/07/14;0,0;1,0;Polokwane;0;1;;;;;;
Wadeville;Wad_MW;CS;SOJJ54N32/82N;C/Suit Jacket J54 Navy S/Orr AGP S32/82 Nigel2402540;4;0;0;R234,86;R939,46;99,0;;2025/11/24;0,0;0,0;Wadeville;4;0;;;;;;
Wadeville;Wad_MW;CS;SOJJ54N32/82W;C/Suit Jacket J54 Navy S/Orr AGP S32/82 Wadville 2402540;4;0;0;R234,86;R939,46;99,0;;2020/10/07;0,0;;;;;;;;;;
Wadeville;Wad_MW;MB;MBCSEGC954;MB C/Suit P/Cott C9 Cut 80/20 E/Green S54/137;6;0;0;R156,50;R938,97;99,0;2024/03/22;2024/01/10;0,0;7,0;Tzaneen;7;4;White River;4;3;;;
Wadeville;Wad_MW;UVEX;9168318;zzUvex Spare Light Grey Smoke Lens Shade 2.5 Discontinued;20;0;0;R46,71;R934,20;99,0;;;0,0;;;;;;;;;;
Wadeville;Wad_MW;MB;AM0212187;MB B/Suit PolyViscose Green Acid Resist S102/40 A1ANG30965A-102/40 ;2;0;0;R467,00;R934,00;99,0;2024/05/03;2024/05/07;0,0;;;;;;;;;;
Wadeville;Wad_MW;MB;AM0212188;MB B/Suit PolyViscose Green Acid Resist S107/42 A1ANG30965A-107/42 ;2;0;0;R467,00;R934,00;99,0;2024/05/03;2024/05/07;0,0;;;;;;;;;;
Wadeville;Wad_MW;GUM;VBBGPSH04;Gumshoe Neptun Shova NSTC Black/Black S04 VBBGPSH    ;7;0;0;R132,80;R929,60;99,0;2025/01/29;2025/02/04;0,0;5,0;White River;6;5;;;;;;
Wadeville;Wad_MW;GLOV;G130/09;Glove Pioneer MaxMac Tough Hand 13g S09  ;10;0;0;R92,25;R922,45;99,0;2024/06/26;2024/07/03;0,0;;;;;;;;;;
Wadeville;Wad_MW;CS;SOTJ54N50/127;C/Suit Trouser J54 Navy S/Orr AGP S50/127  ;6;0;0;R151,51;R909,04;99,0;2023/11/09;2024/11/15;0,0;;;;;;;;;;
Wadeville;Wad_MW;ANS;79-700/10;Ansell Viirtex Reusable Blue Nitrile Glove S10  ;50;0;1500;R18,00;R900,06;99,0;2021/10/26;2023/09/21;0,0;1000,0;Secunda;0;1000;;;;;;
Wadeville;Wad_MW;MB;MBGOCSRBJ54REF46;MB C/Suit Gold Range J54 R/Blue C/W Refl S46/117  ;3;3;30;R300,00;R900,00;99,0;2024/11/13;2025/11/24;0,0;88,0;Bloemfontein;17;41;Middelburg;4;30;Steelpoort;0;14
Wadeville;Wad_MW;BOOT;MR0208;Safety Boot Profit Terrapin PU/RU/MET/KVLR SRC S08;1;0;0;R900,00;R900,00;99,0;2024/06/21;2024/07/17;0,0;2,0;Vereeniging;0;2;;;;;;
Wadeville;Wad_MW;GLOV;GCL20;Glove Chrome Leather RNF Palm 8;29;0;0;R30,94;R897,26;17,4;2023/11/07;2025/05/21;1,7;5,0;Wadeville;29;5;;;;;;
Wadeville;Wad_MW;CS;SOJDL48/122;C/Suit Jacket Denim Ladies S/Orr AGP S48/122 2402733;3;0;0;R298,85;R896,54;99,0;2022/07/05;2022/07/18;0,0;;;;;;;;;;
Wadeville;Wad_MW;3M;D8094;3M Secure Click Cartridge A1B1E1K1P3 Dual Flow 4 P/Box 32 P/Case UU009289347 Price Per Packet/2 ;2;0;0;R446,17;R892,34;99,0;;;0,0;;;;;;;;;;
Wadeville;Wad_MW;DISP;PBCOVERALL3X;PB Disposable Overall 1 Piece 3XL;30;0;0;R29,50;R885,00;99,0;2024/08/27;2024/10/07;0,0;286,0;Bloemfontein;79;276;Tzaneen;0;10;;;
Wadeville;Wad_MW;BOOT;JS05#08;Safety Boot Profit Tarantula Black STC MS S08 Pu/Pu Kevlar;1;0;0;R880,00;R880,00;99,0;2025/02/07;2024/11/25;0,0;18,0;Secunda;5;11;Middelburg;0;2;;;
Wadeville;Wad_MW;DISP;GNYLON-W9;Glove Nylon K/W M/Knitted Composite White S09 L Machine Knitted Composite Knit Wrist;169;0;0;R5,21;R879,77;99,0;2020/02/10;2024/07/12;0,0;;;;;;;;;;
Wadeville;Wad_MW;EYE;GG-16CAF;S/Spec Elvex Go Specs IV  Clear Lens AF/PC Eva Foam Lined Grey/Translucent ;12;0;0;R73,28;R879,36;99,0;2021/11/24;;0,0;12,0;Vereeniging;0;12;;;;;;
Wadeville;Wad_MW;MB;MBFSTRS3XL;MB Freezer Trouser Navy 3XL;5;0;50;R172,00;R860,00;23,6;2025/07/02;2025/11/18;2,3;68,0;Vereeniging;3;19;Tzaneen;9;17;Rustenburg;0;7
Wadeville;Wad_MW;BOOT;JCB1891#03;Safety Boot JCB Hiker Brown Composite Toe Cap S03;1;0;0;R855,00;R855,00;99,0;2025/06/04;2024/10/03;0,0;1,0;Secunda;0;1;;;;;;
Wadeville;Wad_MW;SHOE;RE080812;Safety Rebel Takkie Enduro Max STC Black/Grey S12  ;1;0;0;R849,95;R849,95;99,0;2024/06/27;2024/06/28;0,0;1,0;Middelburg;0;1;;;;;;
Wadeville;Wad_MW;GLOV;34-305#09;Glove Maxicut Nitrile 3/4 Dip Cut 3 Foam L S09   ;9;0;0;R93,94;R845,49;99,0;2022/07/25;2024/11/14;0,0;;;;;;;;;;
Wadeville;Wad_MW;GLOV;GCM5BSS;Glove C Mesh 5 Finger Brown Marker Per Hand SS  ;1;0;0;R841,73;R841,73;99,0;2023/11/07;2024/03/25;0,0;;;;;;;;;;
Wadeville;Wad_MW;SHOE;FSLB5100107;Safety Shoe Sisi Ladies Court STC Black S07  ;2;0;0;R416,21;R832,42;99,0;2024/01/16;2025/01/17;0,0;2,0;Tzaneen;0;1;;;;;;
Wadeville;Wad_MW;GLOV;57H201PLUS-9;Glove TaeKi5 Heat & Cut Chem Res Cut 5 Blue L S09 Composite Liner ;5;0;0;R165,32;R826,60;99,0;2018/08/29;2018/08/30;0,0;;;;;;;;;;
Wadeville;Wad_MW;GUM;ZBG25S05;Gumboot Stimela Black/Grey+STC S05 ZBG25S05 Orange Dot Sosoloza Now Named Stimela;4;0;0;R203,90;R815,60;99,0;2025/05/23;;0,0;11,0;Rustenburg;8;11;;;;;;
Wadeville;Wad_MW;MB;AM0212313;MB B/Suit D59 Orange S152/60 A1ANG800I59-152/60 ;2;0;15;R405,21;R810,42;99,0;2023/06/28;2024/09/02;0,0;;;;;;;;;;
Wadeville;Wad_MW;MB;MBCSGC960;MB C/Suit Poly/Cotton C9 Cut 80/20 Grey S60/152;5;0;0;R162,00;R810,00;99,0;2021/09/06;2022/12/08;0,0;1,0;Phalaborwa;0;1;;;;;;
Wadeville;Wad_MW;ARC;DW-ARC15-J52;Arc C/Suit Jacket HRC2-15 Cal Navy S52/132 With Reflect Tape Silver;1;0;0;R801,42;R801,42;99,0;2024/04/09;2024/03/14;0,0;8,0;Potchefstroom;0;3;;;;;;
