Wadeville;Wad_MW;GLOV;T53-7112-11;Glove Tilsatec RhinoYarn Pu Palm Cut F 13g S11 Long Cuff Reinforced Thumb Antistatic Launderable ;70;0;0;R103,36;R7 235,12;210,0;2024/11/22;2025/07/31;0,3;1,0;Wadeville;70;1;;;;;;
Wadeville;WadSerNDCen_MW;GLOV;GLORHNY-11;Glove Rhino Nitrile Full Dip Yellow S11;710;0;0;R10,18;R7 224,61;213,0;;;3,3;10,0;Wadeville;2750;10;;;;;;
Wadeville;Wad_MW;MB;MBLNTJ54REFP#44;MB C/Suit Trouser J54 Women Navy S44/112 Pink ReflectiveTape;40;0;0;R180,50;R7 219,90;60,0;2023/12/07;2025/08/11;0,7;19,0;Bloemfontein;0;9;Phalaborwa;8;4;;;
Wadeville;Wad_MW;MB;MBJ0ARC402NOM48;MB Arc  Zero Jac Nomex Essential 12.4Cal S48/122 50mm Silver FR Tape Around Two Breast Pockets  Flap And Two Side Pockets FR Velcro Closure;5;0;20;R1 440,71;R7 203,53;75,0;2023/12/05;2026/02/02;0,3;25,0;Polokwane;3;21;Wadeville;5;2;Pretoria;0;1
Wadeville;Wad_MW;MB;AM0212384;MB C/Suit Jacket D59 Closed Front Orange S112/44 J0799800B59 50mm Ind Wash Silver Tape Arms/Breasts X On Back;46;0;0;R155,89;R7 171,00;99,0;2019/07/17;2020/04/16;0,0;;;;;;;;;;
Wadeville;Wad_MW;HNYW;1006195;Goggle Honeywell V-MAXX Clear Lens Fogban  No Vent Textile Strap;59;0;0;R121,20;R7 150,65;99,0;2022/05/11;2022/07/04;0,0;;;;;;;;;;
Wadeville;Wad_MW;GLOV;MEKOWP#S;Glove Miner Mekotek Waterproof Orange SL;47;0;0;R151,62;R7 126,14;99,0;;2024/10/16;0,0;;;;;;;;;;
Wadeville;Wad_MW;MB;AM900002873;MB B/Suit D59 Red Artisan S147/58  A1ANG500B59-147/58  9000002873;19;0;0;R374,89;R7 122,91;99,0;2022/02/25;2022/02/25;0,0;;;;;;;;;;
Wadeville;Wad_MW;MB;AM0212394;MB Trousers D59 Orange S82/32 T1799800B59 50mm Industrial Wash Silver Tape Around Both Legs;55;0;0;R128,91;R7 090,05;99,0;2019/06/12;2023/02/28;0,0;;;;;;;;;;
Wadeville;Wad_MW;MB;AM0856432;MB B/Suit D59 F/Retardant F/Green S87/34  A1ANG317B37-87/34  9000002208;18;0;0;R392,00;R7 056,00;54,0;2024/02/20;2025/09/09;0,3;1,0;Wadeville;18;1;;;;;;
Wadeville;Wad_MW;MB;MBGOCSEGJ5434;MB C/Suit Gold Range J54 Emerald Green S34/87  ;27;0;0;R260,00;R7 020,00;99,0;2021/12/14;2025/01/27;0,0;1,0;Steelpoort;0;1;;;;;;
Wadeville;Wad_MW;MB;MBJRBD5934;MB C/Suit Jacket D59 Royal Blue SABS S34/87  ;47;0;0;R149,00;R7 003,00;99,0;;2024/09/16;0,0;3,0;Polokwane;0;3;;;;;;
Wadeville;Wad_MW;MB;AM0212174;MB C/Suit Poly Viscose B/Green Acid Rep S132/52 C150930971T-132/52 Closed Front 9000001405 Arms/Breasts X On Back;15;0;0;R465,26;R6 978,86;99,0;2023/07/25;2023/07/20;0,0;;;;;;;;;;
Wadeville;Wad_MW;MB;AM0212269;MB C/Suit D59 Closed Front Red S132/52 C1509500B59-132/52  9000001478 50mm Ind Wash Silver Tape Arms/Breasts X On Back;15;0;0;R465,14;R6 977,10;99,0;2023/07/26;2023/12/13;0,0;;;;;;;;;;
Wadeville;Wad_MW;ANS;11-25018W;Ansell Hyflex 11250 Size 18 No Thumbslot Wide  ;100;0;0;R69,16;R6 915,64;99,0;2024/07/17;;0,0;;;;;;;;;;
Wadeville;Wad_MW;ANS;37-185/07;Ansell Sol-Vex Green Nitrile Chem Glove 455mm S07  ;96;0;0;R71,86;R6 898,95;99,0;2023/09/06;2025/02/14;0,0;24,0;Pretoria;24;24;;;;;;
Wadeville;Wad_MW;MB;MBT1ARC402NOM56;MB Nomex Essential Trs Zero Arc  12.4Cal S56/142 Navy C/W 50mm Silver FR Tape Around Legs 2 Flap Pockets & FR Velcro Closure;6;0;0;R1 147,50;R6 885,00;99,0;2022/02/25;;0,0;;;;;;;;;;
Wadeville;Wad_MW;GLOV;T53-7121-11;Glove Tilsatec RhinoYarn Sandy Nitrile Palm S11 Cut F 13g Reinforced Thumb Antistatic Launderable ;68;0;0;R101,09;R6 873,82;204,0;2024/11/22;2025/07/31;0,3;1,0;Wadeville;68;1;;;;;;
Wadeville;Wad_MW;UVEX;9195078;S/Spec Uvex Skyper Brown Lens Black Frame Anti-Scratch Supravision Sapphire ;51;0;0;R134,66;R6 867,66;99,0;;;0,0;;;;;;;;;;
Wadeville;Wad_MW;MB;MBS9MSL600ATFS;MB Two Tone Yel/Navy Mens L/Sleeve Shirt S     With 50mm Silver Reflective Tape Around The Waist Twice And Around Both Arms;28;0;0;R245,00;R6 860,00;16,8;2025/01/24;2026/03/02;1,7;12,0;Middelburg;7;7;Wadeville;28;5;;;
Wadeville;Wad_MW;MB;T1JEM400STD46;MB Denim Stretch Jeans Indigo Blue S46/117  ;31;0;0;R220,00;R6 820,00;99,0;2023/09/14;2023/05/30;0,0;8,0;Bloemfontein;0;6;Vereeniging;0;2;;;
Wadeville;Wad_MW;GLOV;GSH7565-07;Glove Showa Biodegradable Nitrile Black S/6-7 Powder Free/Latex Free/Silicone Free ;28;0;0;R243,48;R6 817,56;42,0;2025/03/12;2025/03/12;0,7;2,0;Wadeville;28;2;;;;;;
Wadeville;Wad_MW;MB;AM0212226;MB B/Suit D59 Royal Blue S107/42  A1ANG406B59-107/42   9000001443;20;0;0;R340,00;R6 800,00;99,0;2023/10/30;2024/02/21;0,0;1,0;Secunda;0;1;;;;;;
Wadeville;Wad_MW;MB;MBS9ARC402ELM2XL;MB BG9030 Navy Arc Flash Shirt No Tape  2XL     15Cal/cm And 13Cal/cm Elim Embroidery ;10;0;0;R680,00;R6 800,00;99,0;2024/12/09;;0,0;;;;;;;;;;
Wadeville;Wad_MW;BOOT;FBBGRAN12;Safety Boot DOT Granite STC Black S12;23;0;0;R292,30;R6 722,82;99,0;2022/06/29;2024/01/17;0,0;;;;;;;;;;
Wadeville;Wad_MW;ANS;ALPHATEC®;Ansell Alphatech Glove Connector Pack Of 5 Pairs  ;95;0;0;R70,49;R6 696,51;142,5;2018/01/18;2025/10/01;0,7;2,0;Wadeville;95;2;;;;;;
Wadeville;Wad_MW;MISC;MANBOOK - E;Book - Manual Invoice -Tzaneen;81;0;0;R81,33;R6 587,37;99,0;2021/07/16;;0,0;;;;;;;;;;
Wadeville;Wad_MW;BELT;ECOBELTS;Belt Reo Economy Black No Braces (S);22;0;0;R298,31;R6 562,87;99,0;2024/03/07;2025/01/30;0,0;;;;;;;;;;
Wadeville;Wad_MW;MB;AM0212202;MB B/Suit D59 Red Artisan S107/42  A1ANG500B59-107/42  9000002865 ;19;0;0;R344,42;R6 543,94;99,0;2024/09/02;2022/02/25;0,0;;;;;;;;;;
Wadeville;Wad_MW;JACK;FRJKTY#M;Vest Flame Retardant Yellow Sleeveless  M With Cellphone Pocket Top Left Front Bottom  Pockets 2 Flaps;65;0;0;R99,89;R6 492,81;19,5;2025/05/09;2025/06/09;3,3;57,0;White River;58;47;Wadeville;65;10;;;
Wadeville;Wad_MW;MB;J0KIL402VFA50;MB C/Suit Jacket D59FA Z/Front Ladies Navy S50/127 50mm Silver FR Refl Tape ;20;0;0;R324,45;R6 489,00;99,0;2025/02/25;;0,0;20,0;Polokwane;0;20;;;;;;
Wadeville;Wad_MW;EYE;SG-18A;S/Spec Elvex Avion Amber Lens HC/PC Grey/Red Frame Grey/Red Frame ;118;0;0;R54,66;R6 449,88;99,0;2022/02/22;;0,0;;;;;;;;;;
Wadeville;Wad_MW;MB;AM0212301;MB C/Suit D59 Closed Front Yellow Ladies S117/46 C1LAJ600S59-117/46  50mm Ind Wash Silver Tape Arms/Breasts X On Back;20;0;0;R321,50;R6 430,00;99,0;2023/04/19;2023/04/19;0,0;;;;;;;;;;
Wadeville;Wad_MW;MB;MBGOCSE58;MB C/Suit Gold Range P/Cott 80/20 E/Green 58/147  ;32;0;0;R200,46;R6 414,88;99,0;2024/03/18;;0,0;;;;;;;;;;
Wadeville;Wad_MW;BS;BSO44;B/Suit D59 S/O Orange S44/112;80;0;0;R80,00;R6 400,00;99,0;2024/12/09;2024/01/25;0,0;2,0;Tzaneen;2;2;;;;;;
Wadeville;Wad_MW;MB;AM0757689;MB B/Suit D59 Royal Blue S167/66  A1ANG406B59-167/66  9000002085;15;0;0;R426,39;R6 395,85;99,0;2022/04/29;2020/08/13;0,0;;;;;;;;;;
Wadeville;Wad_MW;BELT;BELTS;Belt Reo Economy Orange No Braces (S);21;0;0;R304,05;R6 385,05;99,0;2024/03/07;2021/06/24;0,0;;;;;;;;;;
Wadeville;Wad_MW;GLOV;T50-6111-11;Glove Tilsatec RhinoYarn Pu Palm Cut F 10g S11 Reinforced Thumb ;83;0;0;R76,74;R6 369,46;249,0;2024/11/22;2025/07/31;0,3;1,0;Wadeville;83;1;;;;;;
Wadeville;Wad_MW;MB;AM0212324;MB C/Suit D59 Fern Green F/ Retardant S112/44  C2509317B37-112/44  Zip Front 9000001522 50mm FR Silver Tape Around Both Arms;14;0;0;R453,43;R6 348,08;99,0;2023/06/28;2025/03/26;0,0;0,0;Wadeville;14;0;;;;;;
Wadeville;Wad_MW;MB;AM0212231;MB B/Suit D59 Royal Blue S132/52  A1ANG406B59-132/52   9000001448;14;0;0;R449,20;R6 288,80;99,0;2024/09/16;2024/08/29;0,0;1,0;Middelburg;6;1;;;;;;
Wadeville;Wad_MW;ANS;11-200;Ansell Hyflex Sleeve Knitted Flourecent Yellow Cut Resist Hii Vis Polyester Nylon Glass Fibre ;50;0;0;R125,04;R6 252,12;99,0;2022/01/13;2024/09/04;0,0;;;;;;;;;;
Wadeville;Wad_MW;HNYW;T4700/08;Glove Honeywell Nitrile Full Dip Yellow K/W S08 12 Per Pack 120 Per Case;237;0;0;R26,10;R6 186,42;99,0;2022/08/12;;0,0;;;;;;;;;;
Wadeville;Wad_MW;MB;MBT1ARC402NOM60;MB Nomex Essential Trs Zero Arc 12.4Cal 60/152 Navy C/W 50mm Silver FR Tape Around Legs 2 Flap Pockets & FR Velcro Closure;5;0;0;R1 232,50;R6 162,50;99,0;2022/02/25;;0,0;;;;;;;;;;
Wadeville;Wad_MW;EYE;VS-958GY;S/Spec Sportmax Sporty Grey/Smoke Lens H/C ANSI Z87.1 ;772;0;3000;R7,98;R6 162,33;14,6;2025/08/07;2026/03/12;257,7;1519,0;Wadeville;772;899;Vereeniging;16;182;Rustenburg;0;164
Wadeville;WadEmbr_MW;SHRT;WW-GSNREM;Work Wear Golf Shirt - Navy M;36;0;0;R169,95;R6 118,20;108,0;;;0,3;1,0;Wadeville;36;1;;;;;;
Wadeville;Wad_MW;3M;M6899;3M Frame Kit For 6000 Series Full Face 70070709178;10;0;0;R611,05;R6 110,50;99,0;2024/10/10;2024/09/06;0,0;;;;;;;;;;
Wadeville;Wad_MW;SHRT;TT05NBLSS#L;Shirt Vented Cotton Refl Titan Navy Ladies S/S #L;23;7;35;R265,00;R6 095,00;13,9;2025/07/10;2026/03/05;3,7;19,0;Wadeville;23;19;;;;;;
Wadeville;Wad_MW;MB;MBJARCBG9035#54;MB Arc Flash Jkt 2Tone BG9035 Navy/Royal S54/137 50mm Silver FR Tape Around Two Breast Pockets  Flap & Two Side Pockets FR Velcro Closure 19Cal;7;0;10;R850,00;R5 950,00;17,0;2024/08/15;2026/01/29;1,0;18,0;Kathu;0;5;;;;;;
Wadeville;Wad_MW;MB;J0KIL402VFA30;MB C/Suit Jacket D59FA Z/Front Ladies Navy S30/77 50mm Silver FR Refl Tape ;19;0;0;R309,00;R5 871,00;57,0;2025/02/25;2025/08/06;0,3;1,0;Wadeville;19;1;;;;;;
Wadeville;Wad_MW;MB;J0KIL402VFA38;MB C/Suit Jacket D59FA Z/Front Ladies Navy S38/97  50mm Silver FR Refl Tape ;19;0;0;R309,00;R5 871,00;99,0;2025/02/25;2025/02/26;0,0;90,0;Kathu;0;60;Polokwane;0;30;Wadeville;0;0
Wadeville;Wad_MW;MB;MBJARCBG9035#56;MB Arc Flash Jkt 2Tone BG9035 Navy/Royal S56/142 50mm Silver FR Tape Around Two Breast Pockets  Flap & Two Side Pockets FR Velcro Closure 19Cal;7;0;0;R838,46;R5 869,23;99,0;2024/11/08;2024/09/19;0,0;1,0;Potchefstroom;4;1;;;;;;
Wadeville;Wad_MW;EYE;COOLMAXG;S/Spec CoolMax Green Anti Fog SS-9110G  ;272;0;0;R21,49;R5 846,39;816,0;2020/08/25;2025/08/07;0,3;16,0;Newcastle;9;15;Wadeville;272;1;;;
Wadeville;Wad_MW;EYE;SG-51C;S/Spec Elvex Sphere-X Clear Lens HC/PC Vented Frame Black ;120;0;0;R48,41;R5 809,20;99,0;2019/09/25;2019/11/01;0,0;;;;;;;;;;
Wadeville;Wad_MW;MB;MBJ0ARC402NOM30;MB Arc  Zero Jac Nomex Essential 12.4Cal S30/77 50mm Silver FR Tape Around Two Breast Pockets  Flap And Two Side Pockets FR Velcro Closure;6;0;0;R965,00;R5 790,00;99,0;2020/09/04;2024/12/03;0,0;1,0;Pretoria;0;1;;;;;;
Wadeville;Wad_MW;BELT;BELTL;Belt Reo Economy Orange No Braces ( L);20;0;0;R289,04;R5 780,74;99,0;2024/03/07;2021/10/18;0,0;;;;;;;;;;
Wadeville;Wad_MW;MB;MBCSRBREF56;MB C/Suit Gold Range R/Blue Ref Tape S56/142 Poly/Cotton 80/20;27;0;0;R213,27;R5 758,30;81,0;2023/11/30;2026/01/13;0,3;14,0;Steelpoort;5;5;Wadeville;27;4;Pretoria;0;2
Wadeville;Wad_MW;OBS;PBMASK;Mask Fabric 3 Layer Ear Loops;5738;0;0;R1,00;R5 738,00;99,0;;2022/10/21;0,0;;;;;;;;;;
Wadeville;Wad_MW;MB;MBTRBD5950;MB C/Suit Trouser D59 SABS Royal Blue S50/127  ;39;0;0;R145,00;R5 655,00;99,0;;;0,0;;;;;;;;;;
Wadeville;Wad_MW;MB;AM0536977;MB C/Suit D59 Closed Front R/Blue S142/56   C1509406B59-142/56 50mm Ind Wash Silver Tape Arms/Breasts X On Back;24;0;0;R235,00;R5 640,00;99,0;2020/07/29;2019/11/26;0,0;;;;;;;;;;
Wadeville;Wad_MW;3M;M9320+;3M9320+ Aura FFP2 Resp Bulk 440/Case Dust/Mist  Foldable Unvalved P95 (GT500073272);262;0;0;R21,47;R5 625,14;99,0;2023/07/18;2023/07/18;0,0;;;;;;;;;;
Wadeville;Wad_MW;MISC;MANBOOK - F;Book - Manual Invoice -Phalaborwa;50;0;0;R112,13;R5 606,48;99,0;2021/03/23;;0,0;;;;;;;;;;
Wadeville;Wad_MW;MB;MBCSCBC942;MB C/Suit Poly/Cotton C9 Cut 80/20 Brown S42/107;46;0;150;R120,47;R5 541,44;294,0;2025/06/23;2025/11/11;0,7;248,0;Tzaneen;109;230;Potchefstroom;10;10;Wadeville;0;4
Wadeville;Wad_MW;3M;M9152EIND;3M9152E Vflex Healthcare Respirator Unvalved FFP2 Packed Individually UU009685692 700/Case ;661;0;0;R8,38;R5 539,18;99,0;2024/11/14;;0,0;;;;;;;;;;
Wadeville;Wad_MW;MB;MBT1ARC402NOM54;MB Nomex Essential Trs Zero Arc  12.4Cal S54/137 Navy C/W 50mm Silver FR Tape Around Legs 2 Flap Pockets & FR Velcro Closure;5;0;0;R1 105,00;R5 525,00;99,0;2022/02/25;2023/01/17;0,0;1,0;Polokwane;2;1;;;;;;
Wadeville;Wad_MW;MB;MBLNJJ54REFP#44;MB C/Suit Jacket J54 Ladies Navy S44/112 Pink Reflect.Tape;30;0;0;R184,00;R5 520,00;45,0;2024/06/05;2025/08/11;0,7;39,0;Rustenburg;8;14;Middelburg;0;8;;;
Wadeville;Wad_MW;SHOE;FSB21018#5;Safety Shoe Bova Amathole STC Black S05;9;0;0;R610,86;R5 497,74;27,0;2025/06/11;2026/01/07;0,3;2,0;Wadeville;9;2;;;;;;
Wadeville;Wad_MW;MB;MBCSKHC960;MB C/Suit Poly/Cotton C9 Cut 80/20 Khaki S60/152;33;0;0;R166,40;R5 491,20;99,0;2024/04/09;;0,0;2,0;Potchefstroom;5;1;;;;;;
Wadeville;Wad_MW;HNYW;T4700/09;Glove Honeywell Nitrile Full Dip Yellow K/W S09 12 Per Pack 120 Per Case;209;0;0;R26,10;R5 455,54;104,5;2022/08/12;2025/12/17;2,0;33,0;Rustenburg;0;24;Wadeville;209;9;;;
Wadeville;Wad_MW;GLOV;134529;Glove Sillver Talon (XL) Each Per Glove;17;0;0;R320,28;R5 444,74;99,0;2025/04/17;2023/07/25;0,0;85,0;Rustenburg;8;57;Richards Bay;0;23;Pretoria;0;5
Wadeville;Wad_MW;REFL;REFJKTOR#S;Reflective Vest Orange With Sleeves-2  S  ;80;0;0;R68,04;R5 443,25;99,0;2025/05/09;;0,0;7,0;Steelpoort;8;7;;;;;;
Wadeville;Wad_MW;MB;AM0212380;MB C/Suit Jacket D59 Closed Front Orange S92/36 J0799800B59 50mm Ind Wash Silver Tape Arms/Breasts X On Back;34;0;0;R160,00;R5 440,00;99,0;;2022/08/30;0,0;;;;;;;;;;
Wadeville;WadEmbr_MW;SHRT;WW-GSNREL;Work Wear Golf Shirt - Navy L;32;0;0;R169,95;R5 438,40;96,0;;;0,3;1,0;Wadeville;32;1;;;;;;
Wadeville;Wad_MW;ANS;27-805/09;Ansell Hycron Fully Coated Nitrile Glove Open Cuff S09;144;0;0;R37,48;R5 397,49;99,0;2022/01/13;2022/10/17;0,0;112,0;Vereeniging;0;112;;;;;;
Wadeville;Wad_MW;GLOV;T55-1725-07;Glove Tilsatec Nitrile Mircofoam Palm Cut A S07 15g Reinforced Thumb Touchscreen Ultrahigh  Abrasion And Comfort ;97;0;0;R55,51;R5 384,23;99,0;2024/11/22;;0,0;;;;;;;;;;
Wadeville;Wad_MW;REFL;REFJKTOR#3XL;Reflective Vest Orange With Sleeves-2  3XL  ;79;0;0;R68,04;R5 375,21;237,0;2025/05/09;2026/02/17;0,3;6,0;Steelpoort;10;5;Wadeville;79;1;;;
Wadeville;Wad_MW;CS;SOTDREIN54/137;C/Suit Trouser Denim Reinf C/H S/Orr AGP S54/137 14N69M0466 PA-19082 V01 2402625    CS;12;0;0;R447,14;R5 365,71;99,0;2024/02/14;2024/02/01;0,0;;;;;;;;;;
Wadeville;Wad_MW;MB;MBT1ARC402NOM52;MB Nomex Essential Trs Zero Arc  12.4Cal S52/132 Navy C/W 50mm Silver FR Tape Around Legs 2 Flap Pockets & FR Velcro Closure;5;0;0;R1 070,31;R5 351,56;99,0;2022/06/06;2024/04/26;0,0;1,0;Secunda;0;1;;;;;;
Wadeville;Wad_MW;MB;MBCSTRBJ54REF38;MB C/Suit Trs J54 R/Blue C/W Refl Tape S38/97  ;39;0;0;R136,77;R5 334,14;99,0;2023/11/20;2021/05/27;0,0;;;;;;;;;;
Wadeville;Wad_MW;MB;MBGOCSE32;MB C/Suit Gold Range P/Cot 80/20 E/Green S32/82  ;35;0;0;R152,25;R5 328,74;26,3;2025/08/04;2026/03/20;1,3;148,0;Tzaneen;28;124;Potchefstroom;9;8;Vereeniging;0;7
Wadeville;Wad_MW;GLOV;T55-1725-11;Glove Tilsatec Nitrile Mircofoam Palm Cut A S11 15g Reinforced Thumb Touchscreen Ultrahigh  Abrasion And Comfort ;96;0;0;R55,51;R5 328,72;99,0;2024/11/22;;0,0;1,0;Tzaneen;10;1;;;;;;
Wadeville;Wad_MW;MB;MBCSRBC958;MB C/Suit Poly/Cott C9 Cut 80/20 R/Blue S58/147  ;33;0;0;R160,83;R5 307,23;99,0;2023/11/17;2024/11/22;0,0;3,0;Tzaneen;5;2;Potchefstroom;4;1;;;
Wadeville;Wad_MW;EYE;SG-18C;S/Spec Elvex Avion Clear Lens HC/PC Grey/Red Frame Grey/Red Frame ;96;0;0;R54,81;R5 261,76;99,0;2022/05/05;2021/07/22;0,0;;;;;;;;;;
Wadeville;Wad_MW;REFL;HV200FR2XL;Reflective Vest EN4 FR Lime Velcro 2XLReflective Vest EN4 FR Lime Velcro 2XL ;37;0;0;R142,08;R5 256,96;99,0;2024/11/20;2024/11/28;0,0;0,0;Wadeville;37;0;;;;;;
Wadeville;Wad_MW;MB;J0KIL402VFA46;MB C/Suit Jacket D59FA Z/Front Ladies Navy S46/117 50mm Silver FR Refl Tape ;17;0;0;R309,00;R5 253,00;99,0;2025/02/25;2025/02/26;0,0;70,0;Kathu;0;40;Polokwane;0;30;Wadeville;0;0
Wadeville;WadSerNewVaal_MW;REFL;EN4-EPLS#S;Reflective Vest EN4 Lime Zip & ID Pouch SReflective Vest EN4 Lime Zip & ID Pouch S ;115;0;0;R45,32;R5 211,50;15,7;;;7,3;43,0;Wadeville;115;22;Pretoria;43;21;;;
Wadeville;Wad_MW;MB;T1SSW30971T46;MB C/Suit Trouser P/Viscose Acid Sappi S46/117 50mm Lime/Silver Refl Tape Around Both Legs;28;0;0;R185,93;R5 206,02;99,0;;;0,0;;;;;;;;;;
Wadeville;Wad_MW;GUM;XBG25SOMW09;Gumboot Stimela XP Blk/Grey CompTC+ SMS -WCalf S09 XBG25SOMW Orange Diamond;22;0;0;R236,30;R5 198,60;99,0;;2021/10/06;0,0;;;;;;;;;;
Wadeville;Wad_MW;BOOT;FBT4160305;Safety Boot Bova Nebula STC PU/Rubber Brown S05 Now 43603 Was 41603;5;0;0;R1 037,23;R5 186,15;15,0;2025/06/11;2025/04/16;0,3;48,0;Richards Bay;11;33;Kathu;0;10;Secunda;0;2
Wadeville;Wad_MW;EAR;EM/INNERF;Earmuff Inner Foam Red/Black;400;0;0;R12,95;R5 178,65;99,0;2025/08/07;;0,0;;;;;;;;;;
Wadeville;Wad_MW;MB;AM0212393;MB Trousers D59 Orange S77/30 T1799800B59 50mm Industrial Wash Silver Tape Around Both Legs;24;0;0;R215,65;R5 175,60;99,0;2023/06/23;2023/04/24;0,0;;;;;;;;;;
Wadeville;Wad_MW;ANS;47-409/07;Ansell Hylite F/Coated Blue Nitrile O/Cuff 290mm  S07;143;0;0;R36,17;R5 172,31;99,0;;2023/10/12;0,0;;;;;;;;;;
Wadeville;Wad_MW;GLOV;GSH381-08;Glove Showa Embossed Microporous Nitrile L S08 Latex Free General Purpose ;139;0;0;R37,18;R5 168,15;15,4;2024/01/18;2025/06/09;9,0;52,0;Wadeville;139;27;Secunda;6;24;Bloemfontein;0;1
Wadeville;Wad_MW;ANS;37-900/09;Ansell Sol-Vex Red Nitrile Chem Glove 380mm S09  ;135;0;0;R38,18;R5 154,30;99,0;;2022/06/09;0,0;157,0;Vereeniging;0;157;;;;;;
Wadeville;Wad_MW;GLOV;GSH381-06;Glove Showa Embossed Microporous Nitrile S S06 Latex Free General Purpose ;138;0;0;R37,18;R5 130,96;99,0;2024/01/18;2024/10/15;0,0;;;;;;;;;;
Wadeville;Wad_MW;MB;MBGOCSRBJ5440;MB C/Suit Gold Range J54 Royal Blue S40/102  ;18;0;0;R285,00;R5 130,00;18,0;2025/03/06;2025/10/24;1,0;104,0;Phalaborwa;20;72;Bloemfontein;0;12;White River;0;10
Wadeville;Wad_MW;MB;MBTRBD5942;MB C/Suit Trouser D59 SABS Royal Blue S42/107  ;33;0;0;R154,80;R5 108,49;99,0;2022/04/08;2024/09/16;0,0;2,0;Vereeniging;6;2;;;;;;
Wadeville;Wad_MW;3M;M6582;3M EN Rugged ConFort QL Cradle Each 70071668175;94;0;0;R54,03;R5 078,80;282,0;2021/05/21;2025/12/01;0,3;14,0;Richards Bay;1;13;Wadeville;94;1;;;
Wadeville;Wad_MW;EYE;B/MAXG;S/Spec BlackMax Green Lens Anti Fog SS1840BGA  ;191;0;0;R26,51;R5 063,57;22,9;2023/06/28;2025/11/05;8,3;47,0;Wadeville;191;25;Pretoria;15;15;Steelpoort;0;7
Wadeville;Wad_MW;MB;AM0212221;MB B/Suit D59 Royal Blue S82/32 A1ANG406B59-82/32   9000001438;23;0;0;R220,00;R5 060,00;99,0;2020/02/24;2021/10/18;0,0;;;;;;;;;;
Wadeville;Wad_MW;MB;MBJARCBG9035#28;MB Arc Flash Jacket 2Tone BG9035 Navy/Royal S28/72 50mm Silver FR Tape Around Two Breast Pockets  Flap & Two Side Pockets FR Velcro Closure 19Cal;6;0;0;R838,71;R5 032,26;99,0;2024/11/08;2024/10/15;0,0;30,0;Kathu;0;30;;;;;;
Wadeville;Wad_MW;BELT;BELTXL;Belt Reo Economy Orange No Braces (XL);21;0;0;R236,40;R4 964,40;99,0;2022/02/10;2021/12/09;0,0;;;;;;;;;;
Wadeville;Wad_MW;MB;MBGOCSJKTD44;MB C/Suit Gold Range Jacket Denim 12Oz S44/112  ;39;2;20;R127,24;R4 962,19;17,1;;2026/02/11;3,3;30,0;Wadeville;39;22;Potchefstroom;0;8;;;
Wadeville;Wad_MW;GUM;GSH13805;Gumboot Stimela Black/Grey+STC+Metatarsal+SMS S05 ZBG25SMP05 Green Dot Sosoloza Now Named Stimela Now Renamed Stimela;15;0;0;R330,08;R4 951,18;15,0;2025/04/29;2025/12/03;1,0;202,0;Rustenburg;226;115;Polokwane;41;81;Wadeville;0;6
Wadeville;WadEmbr_MW;REFL;REFTAPES;Reflective Tape Silver 25mm X 50m ;1800;0;0;R2,75;R4 950,00;99,0;2023/04/06;;0,0;62,0;Pretoria;22;62;;;;;;
Wadeville;Wad_MW;MISC;MANBOOK - A;Book - Manual Invoice -Wadeville;52;0;0;R95,04;R4 941,82;99,0;2021/03/23;;0,0;;;;;;;;;;
Wadeville;Wad_MW;MB;AM0212266;MB C/Suit D59 Closed Front Red S117/46 C1509500B59-117/46  9000001476 50mm Ind Wash Silver Tape Arms/Breasts X On Back;15;0;0;R328,85;R4 932,75;99,0;2023/04/18;2024/11/22;0,0;;;;;;;;;;
Wadeville;Wad_MW;MB;MBCSEGC932;MB C/Suit P/Cott C9 Cut 80/20 E/Green S32/82;41;0;0;R120,08;R4 923,25;99,0;2024/06/21;2024/02/14;0,0;40,0;White River;30;21;Tzaneen;21;19;;;
Wadeville;Wad_MW;MB;AM0856434;MB B/Suit D59 F/Retardant F/Green S97/38  A1ANG317B37-97/38  9000002210;11;0;0;R446,95;R4 916,50;99,0;2024/09/16;2023/11/21;0,0;;;;;;;;;;
Wadeville;Wad_MW;MB;J0KIL402VFA36;MB C/Suit Jacket D59FA Z/Front Ladies Navy S36/92 50mm Silver FR Refl Tape ;16;0;0;R306,95;R4 911,22;99,0;2025/02/25;2025/02/26;0,0;30,0;Polokwane;0;30;Wadeville;16;0;;;
Wadeville;Wad_MW;RESP;DMGRN6200RH5;Dust Mask Greenline Rhino FFP2 UnValved Cup Style  5 Masks Per Packet  P/N 6200 Price Per Packet;178;500;0;R27,50;R4 895,00;99,0;2023/10/27;;0,0;14,0;Richards Bay;350;9;Middelburg;8;4;Tzaneen;0;1
Wadeville;Wad_MW;ANS;87-118/07;Ansell Alphatec Black Heavy Weight-G17KS06.5  ;246;0;0;R19,88;R4 890,46;99,0;2021/06/20;2026/03/19;0,0;0,0;Pretoria;300;0;;;;;;
Wadeville;Wad_MW;MB;MBCSTNJ5444;MB C/Suit Trs J54 Navy S44/112;31;0;0;R157,74;R4 889,94;99,0;2024/07/23;2026/03/10;0,0;1,0;Bloemfontein;0;1;Wadeville;31;0;;;
Wadeville;Wad_MW;MB;MBGOCSRB30;MB C/Suit Gold Range P/Cot 80/20 R/Blue S30/77  ;32;0;0;R152,23;R4 871,21;19,2;2025/05/21;2026/02/25;1,7;58,0;Tzaneen;26;14;Vereeniging;53;13;Wadeville;0;9
Wadeville;Wad_MW;SHRT;LL-MAD#M;Blouse Ladies Madison Barron (Add Colour) M;20;0;0;R242,99;R4 859,80;99,0;2025/05/27;2025/06/06;0,0;0,0;Wadeville;20;0;;;;;;
Wadeville;Wad_MW;MB;MBJ0ARC402NOM42;MB Arc  Zero Jac Nomex Essential 12.4Cal S42/107 50mm Silver FR Tape Around Two Breast Pockets  Flap And Two Side Pockets FR Velcro Closure;3;2;10;R1 618,07;R4 854,20;33,0;2024/09/30;2025/05/28;0,3;32,0;Polokwane;3;29;Pretoria;0;2;Wadeville;0;1
Wadeville;Wad_MW;GLOV;GBNLXXL;Glove Nitrile Inyathi Black Coated Palm 2XL S11  ;454;0;0;R10,61;R4 815,62;18,9;2024/12/04;2026/03/06;24,0;196,0;Wadeville;454;102;Phalaborwa;102;94;;;
Wadeville;Wad_MW;MB;MBG1ETX700NOM3XL;MB Nomex Extreme Knitted Golf Shirt Navy 3XL ;3;0;0;R1 600,00;R4 800,00;99,0;2025/03/07;;0,0;;;;;;;;;;
Wadeville;Wad_MW;MB;AM0212395;MB Trousers D59 Orange S87/34  T1799800B59 50mm Industrial Wash Silver Tape Around Both Legs;35;0;0;R136,72;R4 785,23;99,0;2019/08/01;2020/04/16;0,0;;;;;;;;;;
Wadeville;Wad_MW;MB;MBJ0ARC402NOM44;MB Arc  Zero Jac Nomex Essential 12.4Cal S44/112 50mm Silver FR Tape Around Two Breast Pockets  Flap And Two Side Pockets FR Velcro Closure;3;0;30;R1 593,48;R4 780,44;99,0;2024/04/15;2026/02/13;0,3;36,0;Polokwane;0;33;Wadeville;3;1;;;
Wadeville;Wad_MW;MB;AM0212326;MB C/Suit D59 Fern Green F/Retardant S122/48 C2509317B37-122/48 Zip Front  9000001524 50mm FR Silver Tape Around Both Arms;15;0;0;R318,57;R4 778,55;99,0;2021/09/15;2024/12/03;0,0;;;;;;;;;;
Wadeville;WadBots_MW;CHEM;PBSAN100ML;"Hand Sanitizer Liquid ""Pienaar Bros"" 100ml 70% Alcohol";450;0;0;R10,50;R4 725,00;99,0;;2024/05/09;0,0;;;;;;;;;;
Wadeville;Wad_MW;CS;SOJJ54N28/72;C/Suit Jacket J54 Navy S/Orr AGP S28/72 2402614;21;0;0;R224,05;R4 704,96;99,0;2023/11/09;2025/02/17;0,0;;;;;;;;;;
Wadeville;Wad_MW;ARC;DW-ARC12-P#34;Arc C/Suit Trouser HRC2-12.4 Cal Navy S34/87 With Reflect Tape Silver ;6;0;0;R775,00;R4 650,00;99,0;2021/01/11;2024/05/14;0,0;20,0;Kathu;0;20;;;;;;
Wadeville;Wad_MW;MB;AM0212268;MB C/Suit D59 Closed Front Red S127/50 C1509500B59-127/50  9000001478 50mm Ind Wash Silver Tape Arms/Breasts X On Back;10;0;0;R463,60;R4 636,00;99,0;2023/11/28;2023/12/14;0,0;;;;;;;;;;
Wadeville;Wad_MW;MB;AM2366769;MB C/Suit D59 Ladies 2 Tone Navy/Orange S54/137 Closed Front Ind Silver Ref Arms Legs Chest  X On Back C1THU402B59-54/137;12;0;0;R385,00;R4 620,00;99,0;2025/01/24;2025/02/04;0,0;;;;;;;;;;
Wadeville;Wad_MW;MISC;MANBOOK - C;Book - Manual Invoice -White River;53;0;0;R86,54;R4 586,46;99,0;2023/07/03;;0,0;;;;;;;;;;
Wadeville;Wad_MW;BOOT;FBB2170205;Safety Boot Bova Munich 2.0 SMS STC Black S05  ;7;0;0;R654,76;R4 583,32;99,0;2023/03/02;2026/03/05;0,0;;;;;;;;;;
Wadeville;Wad_MW;ANS;11-925/11;Ansell Hyflex Oil Repell Nitrile Palm Coat S11 Blue (3111);120;0;0;R38,17;R4 580,40;99,0;;2021/10/25;0,0;24,0;Vereeniging;0;24;;;;;;
Wadeville;Wad_MW;OBS;PB95MNOSEB;PB95 Cloth Mask Pleated Blue With Nose Bridge  One Size Fits All;4579;0;0;R1,00;R4 579,00;99,0;2020/06/11;2022/05/31;0,0;;;;;;;;;;
Wadeville;Wad_MW;BOOT;FBB4000212;Safety Boot Bova Dakota STC Black S12  ;6;0;0;R759,81;R4 558,86;99,0;2021/08/25;2021/11/25;0,0;;;;;;;;;;
Wadeville;Wad_MW;GLOV;HP6183;Glove Yellow Leather Lined A Grade 1.4mm Thick  ;96;0;0;R47,30;R4 540,80;99,0;2019/10/07;2019/11/25;0,0;;;;;;;;;;
Wadeville;WadSerNDCen_MW;MB;AM0212231;MB B/Suit D59 Royal Blue S132/52  A1ANG406B59-132/52   9000001448;10;0;0;R449,20;R4 492,00;99,0;;;0,0;1,0;Middelburg;6;1;;;;;;
Wadeville;Wad_MW;MB;MBLNTJ54REFP#42;MB C/Suit Trouser J54 Women Navy S42/107 Pink ReflectiveTape;24;0;0;R185,98;R4 463,44;18,0;2024/02/16;2025/08/11;1,3;20,0;Rustenburg;12;6;;;;;;
Wadeville;Wad_MW;EYE;SG-12C;S/Spec Elvex Acer Clear Lens HC/PC Graphite Frame Graphite Frame ;56;0;0;R79,32;R4 442,03;99,0;2022/07/04;2018/03/12;0,0;;;;;;;;;;
Wadeville;Wad_MW;MB;MBFJKTREF4XL;MB Freezer Jacket Navy Relflective Tape 4XL;18;0;20;R246,00;R4 428,00;57,0;2025/07/22;2025/11/03;0,7;105,0;Bloemfontein;0;105;Wadeville;18;0;;;
Wadeville;Wad_MW;MB;MBGOCSEGJ5448;MB C/Suit Gold Range J54 Emerald Green S48/122  ;17;0;0;R260,00;R4 420,00;99,0;2021/12/14;2025/01/27;0,0;;;;;;;;;;
Wadeville;Wad_MW;DUPO;D13984657;D13984657 Tychem 2000C Apron Pa30L0 Shin-Length With Neck And Waist  Ties Yellow One Size;93;0;0;R47,41;R4 409,14;99,0;2019/05/27;2024/03/05;0,0;;;;;;;;;;
Wadeville;Wad_MW;MB;MBLNTJ54REFP#46;MB C/Suit Trouser J54 Women Navy S46/117 Pink ReflectiveTape;24;0;0;R183,40;R4 401,65;24,0;2023/12/07;2025/08/11;1,0;9,0;Bloemfontein;0;6;Wadeville;24;3;Rustenburg;0;0
Wadeville;Wad_MW;ANS;48-919/10;Ansell Edge D/Layer Nitrile Coat Black/Red S10 ;160;0;0;R27,50;R4 399,27;24,0;2025/08/18;2026/02/18;6,7;70,0;Secunda;10;50;Wadeville;160;20;;;
Wadeville;Wad_MW;MB;AM0212173;MB C/Suit Poly Viscose B/Green Acid Rep S127/50 C150930971T-127/50 Closed Front Arms/Breasts X On Back;14;0;0;R312,87;R4 380,18;99,0;2021/09/15;2022/11/15;0,0;;;;;;;;;;
Wadeville;Wad_MW;3M;HF-802SD;3M Secure Click Respirator Half Face HF-802SD M 10 Per Case UU009622216 ;13;0;0;R336,08;R4 369,06;99,0;2025/05/19;;0,0;;;;;;;;;;
Wadeville;Wad_MW;GLOV;GSH383-10;Glove Showa Microporous Nitrile With EBT S10 And Embossed S-Shaped Palm Finish;62;0;0;R70,42;R4 366,08;18,6;2023/05/25;2025/05/07;3,3;10,0;Wadeville;62;10;;;;;;
Wadeville;Wad_MW;MB;MBTRBD5934;MB C/Suit Trouser D59 SABS Royal Blue S34/87  ;25;0;0;R174,53;R4 363,34;99,0;2023/02/06;2024/10/07;0,0;11,0;Vereeniging;0;11;;;;;;
Wadeville;Wad_MW;MB;MBGOCSRBJ5456;MB C/Suit Gold Range J54 Royal Blue S56/142  ;17;0;0;R256,10;R4 353,70;99,0;2023/03/22;2022/11/03;0,0;;;;;;;;;;
